,sentence,#aspect terms,aspect_terms,at_polarity
1383,"हमें हंसी आई जब उसने finally हमें एक dessert menu की offer की और हमने एक 10 percent tip छोड़ दिया, जो मुझे लगता है, generous था।",2,"['dessert menu', 'tip']","['neutral', 'positive']"
1384,और जैसे आपको मिला उसके prices high करने के way थे।,1,['prices'],['negative']
1385,"लेकिन Sichuan के लोग इसे बेहद पसंद करेंगे) - Chongqing Hot Pot, chongqing Sichuan का सबसे बड़ा city था, जो अब एक independent province बन गया है।",0,[],[]
1386,"Skip Baroanda down the street (Eurotrashy, snooty and expensive) and check this place out!",0,[],[]
1387,इस location को छोड़े और Soho में जाएं।,0,[],[]
1388,"इतनी rude service होने के बाद, वहाँ रहते हुए किसी भी तरह का conversation करने में interested होने पर किसी को कभी भी recommend नहीं करूंगा।",1,['service'],['negative']
1389,"मैं sunday afternoon को अपनी चार girlfriends के साथ Areo में गया, और वहां तीन enjoyable hours बिताए।",0,[],[]
1390,"Saturday nights को  in-house lady DJ के music ने कमाल का taste दिया, और इसके अलावा भी, request लेते हैं।",2,"['music', 'in-house lady DJ']","['positive', 'positive']"
1391,"मुझे full होने के लिए at least तीन rolls की जरूरत है, और वो भी कम से कम 14.00 $ में। ",1,['rolls'],['neutral']
1392,"कोई भी जो कभी भी Thai restaurant में खाया हो, बहुत disappointment होगा।",0,[],[]
1393,"यह सब simply amazing, unique और tasty था और सबसे best यह bank को नहीं break करता था।",0,[],[]
1394,"Great wine list, reasonably priced.--Sara",2,"['wine list', 'priced']","['positive', 'positive']"
1395,बीच में hot dogs ठंडे थे और buns stale थे।,2,"['hot dogs', 'buns']","['negative', 'negative']"
1396,"हालांकि food excellent था, यह cheap नहीं था (फिर भी बहुत costly नहीं था)।",1,['food'],['positive']
1397,साथ में Beef noodle soup भी अच्छा है।,1,['Beef noodle soup'],['positive']
1398,इस place को मिली bad reviews को पढ़कर मुझे बहुत दुख हुआ!,0,[],[]
1399,Delivery service भी शानदार है।,1,['Delivery service'],['positive']
1400,मैंने smile के साथ prompt service प्राप्त की।,1,['service'],['positive']
1401,Place शांत और delightful था।,1,['Place'],['positive']
1402,Molto bene!,0,[],[]
1403,Chinatown masters के अलावा मुझे सबसे best मिला है।,0,[],[]
1404,वे amazing हैं!,0,[],[]
1405,Food कुल मिलाकर एक हीरा है -- food delicious है और herbs एवं tomatoes के perfect balance के साथ homemade है।,4,"['Food', 'food', 'herbs', 'tomatoes']","['positive', 'positive', 'positive', 'positive']"
1406,A must try!,0,[],[]
1407,"जितना मुझे वहां का food पसंद है, मैं वहाँ से खुद को back नहीं ला सकता।",1,[],['positive']
1408,यह partly रूप से shredded cheese की तरह दिखता था - जो अभी भी strips में है।,1,['shredded cheese'],['negative']
1409,West Village में इसे consider करते हुए prices और ambience मुख्य रूप से कमाल का है।,2,"['prices', 'ambience']","['positive', 'positive']"
1410,Soup भी बहुत अच्छा है।,1,['Soup'],['positive']
1411,एक week के notice के साथ NYC में top place पर reservation पाना बहुत आसान है।,1,['reservation'],['positive']
1412,मैंने कभी भी humble root vegetables या एक mushroom consomme का आनंद नहीं लिया है - और यह chef बिना fat के accomplish करता है।,3,"['root vegetables', 'mushroom consomme', 'chef']","['positive', 'positive', 'positive']"
1413,"यदि आप Roth's जाते हैं तो Mike से served लेने की कोशिश करें, तो वह great है !!",1,['served'],['positive']
1414,"एक month पहले की visit के आधार पर, मैं Christmas के एक week पहले वापस आया और बेहद disappoint था।",0,[],[]
1415,मुझे हमेशा Shabu-Shabu dinner मिलता है और beef हमेशा fresh रहता है।,2,"['Shabu-Shabu dinner', 'beef']","['neutral', 'positive']"
1416,Pizza cold deliver किया गया था और cheese पूरी तरह से melt भी नहीं हुआ था!,2,"['Pizza', 'cheese']","['negative', 'negative']"
1417,"Nha Trang, comfort और decor की पूरी तरह से कमी के लिए notorious होने के बावजूद, horribly रूप से  slow wait staff और horribly quick meals, मैं अब तक के सबसे अच्छे vietnamese restaurants में से एक है। जहां pho delicious और बहुत fresh vegtables के साथ आता है।",6,"['comfort', 'decor', 'wait staff', 'meals', 'pho', 'vegtables']","['negative', 'negative', 'negative', 'negative', 'positive', 'positive']"
1418,"दूसरी hand में, यदि आप easily fool नहीं कर सकते हैं, आपको hundreds of restaurants मिलेगा कि जिसमें आपको service और ambience Alain Ducasse के बराबर दिखेगा, और food जो presentation, taste, choice, quality और quantity में दिखेगा।",8,"['service', 'ambience', 'food', 'presentation', 'taste', 'choice', 'quality', 'quantity']","['neutral', 'neutral', 'negative', 'negative', 'negative', 'negative', 'negative', 'negative']"
1419,We will definitely go back.,0,[],[]
1420,"मैं neighborhood में रहता हूं और मेरे friends यहां bar scene के लिए नहीं, बल्कि 3 बजे The Pizza Place के promise के लिए मुझसे मिलते हैं।",1,['bar scene'],['positive']
1421,बस एक way है जो gone days में था।,0,[],[]
1422,Food अद्भुत है !!!!,1,['Food'],['positive']
1423,"Portions अब बहुत छोटे हैं, sauces  overly-ambitious हैं, usually पर inedible होते हैं जबकि service अभी भी अच्छी है, restaurant, इसकी popularity के कारण frantic लगता है।",3,"['Portions', 'sauces', 'service']","['negative', 'negative', 'positive']"
1424,"Price के लिए, आप Manhattan में इतनी अच्छी तरह से नहीं खा सकते हैं।",1,['Price'],['positive']
1425,"Owner बहुत friendly और एक great guy है, उसके pizza को try करो, आपको यह पसंद आएगा!",2,"['Owner', 'pizza']","['positive', 'positive']"
1426,Atmosphere शानदार है !!!,1,['Atmosphere'],['positive']
1427,"UWS पर बहुत से अच्छे restaurants के साथ, मुझे overpriced food, absurdly arrogant wait-staff की जरूरत नहीं है जो glorified diner, clumsy service और management work के care को recognize नहीं करता है।",5,"['food', 'wait-staff', 'service', 'management', 'diner']","['negative', 'negative', 'negative', 'negative', 'negative']"
1428,"मैं sushi restaurant को इसके sea urchin से judge करता था, जो sushi rose में heavenly था।",1,['sea urchin'],['positive']
1429,Service time पर थोड़ी scatty होती है लेकिन food आने पर सब forgiven हो जाता है।,2,"['Service', 'food']","['negative', 'positive']"
1430,और उन terms पर evaluate किया गया Pastis बस wonderful है।,0,[],[]
1431,"Atmosphere सबसे greatest नहीं है, लेकिन मुझे लगता है कि वे ऐसे ही prices को कम रखते हैं।",2,"['Atmosphere', 'prices']","['neutral', 'positive']"
1432,"यदि आपका पसंदीदा Chinese food General Tao chicken है, तो यह place आपके लिए नहीं है।",2,"['General Tao chicken', 'Chinese food']","['negative', 'neutral']"
1433,आपको shrimp appetizers को try करना चाहिए।,1,['shrimp appetizers'],['positive']
1434,"आसपास में न केवल cuisine best है, बल्कि service भी हमेशा attentive और charming रही है।",2,"['cuisine', 'service']","['positive', 'positive']"
1435,"भले ही आप Suits से filled हो, आप कभी भी terribly comfortable feel नहीं कर सकते हैं।",0,[],[]
1436,"Waiters drinks को पूरी तरह से भूल जाते हैं, food portions बहुत छोटे होते हैं, two people को एक entree share करने में problem होती है।",4,"['Waiters', 'food portions', 'drinks', 'entree']","['negative', 'negative', 'neutral', 'negative']"
1437,"मेरी wife और मैं कई years से nyc जा रहे हैं और यह याद नहीं कि roxy's food expensive है, लेकिन यह new नहीं है!",1,['food'],['conflict']
1438,"यह ऐसे ही है जैसे कि आपको Italian countryside में transport किए गए थे, जो बहुत romantic और antiques से भरे हुए थे।",0,[],[]
1439,Just go and see for yourself.,0,[],[]
1440,"दिलचस्प selection, अच्छा wines, अच्छी service, fun decor.",3,"['wines', 'service', 'decor']","['positive', 'positive', 'positive']"
1441,I hate this.,0,[],[]
1442,"चाहे वह  parmesean porcini souffle या lamb glazed with balsamic vinegar, आपको निश्चित रूप से एक bite में Northern Italy की सैर कराएगा।",2,"['parmesean porcini souffle', 'lamb glazed with balsamic vinegar']","['positive', 'positive']"
1443,Sally वह place शानदार था!,0,[],[]
1444,इस place का food gourmet का Indian cuisine है।,2,"['food gourmet', 'Indian cuisine']","['neutral', 'neutral']"
1445,अंत में एक विश्वसनीय Chinese restaurant!,0,[],[]
1446,get over it!,0,[],[]
1447,"हालांकि, यह सिर्फ इतना होता है कि street के just down और भी amazing place लगता है।",0,[],[]
1448,"जबकि एक अच्छे corned beef sandwich के लिए बहुत सारे place हैं, इसमें Katz's का एक अपना charm है।",1,['corned beef sandwich'],['positive']
1449,"हालाँकि, हमारे पास की table को देखते हुए, हम दोनों ने pizza order करना चाहा, जो कि PERRECT दिखता था।",1,['pizza'],['positive']
1450,"Fish adequate था, लेकिन बेवजह कटा हुआ था।",1,['Fish'],['conflict']
1451,मैं एक weekend night में order देने के लिए recommend करता हूं।,0,[],[]
1452,"यदि आप new york city में रहते हैं, तो आपको time square के बाहर small restaurants में better food मिलेगा और आधा amount खर्च करना होगा।",2,"['food', 'amount']","['negative', 'negative']"
1453,Olive cream cheese या lox spread को पूरे wheat के bagel पर लगाकर try करें।,3,"['Olive cream cheese', 'lox spread', 'bagel']","['positive', 'positive', 'neutral']"
1454,"हालांकि यह Nobu नहीं है, लेकिन यह एक बड़ी बात है आप definitely से satisfy और full होना छोड़ देंगे।",0,[],[]
1455,तो मेरे husband ने एक excuse बनाया कि हम leave कर सकें।,0,[],[]
1456,"यह बहुत spicy है, लेकिन offensive नहीं है।",0,[],[]
1457,"वे दूसरे के service से disappoint नहीं हुए, मैं जब door पर आया तो extremely pleasent और attentive के साथ लगभग हर table पर एक server था। ",3,"['service', 'server', 'table']","['positive', 'positive', 'neutral']"
1458,"मैं नहीं जानता कि वे क्या सोचते हैं कि वे कौन हैं, लेकिन उनके residents of the neighborhood के लिए कोई respect नहीं है क्योंकि उन्होंने अपने cabaret को अगले door के लिए खोल दिया और summer के दौरान हर weekend morning 3 बजे तक loud music का blast हुआ।",1,['music'],['negative']
1459,उन्होने top पर shredded cheese का प्रयोग किया है।,1,['shredded cheese'],['neutral']
1460,वे Chinatown के middle में located हैं!,0,[],[]
1461,Katz's deli का एक great NY experience है।,0,[],[]
1462,Check it out.,0,[],[]
1463,"एकमात्र सकारात्मक था कि wait staff जो prompt, knowledgable और likeable था।",1,['wait staff'],['positive']
1464,मैं उनके Godmother pizza को किसी भी higher पर दोबारा reccommend नहीं कर सकता।,1,['Godmother pizza'],['positive']
1465,"मैं vegetarian नहीं हूँ, लेकिन लगभग all dishes बढ़िया थे।",1,['dishes'],['positive']
1466,मैं इस low-key upper eastsider और उनके प्रामाणिक thai cuisine से बहुत प्रभावित था !!!,1,['thai cuisine'],['positive']
1467,मैं फिर जाऊंगा यदि मुझे pay नहीं करना पड़ा।,0,[],[]
1468,मैंने crab cocktail का order दिया और यह एक lime juice concoction में भिगोया गया था जहां आप सभी lime का taste ले सकते थे।,3,"['crab cocktail', 'lime juice concoction', 'lime']","['negative', 'neutral', 'neutral']"
1469,"हम इस place पर many times आए हैं, और हमेशा शानदार food, wine और service पाये हैं।",3,"['food', 'wine', 'service']","['positive', 'positive', 'positive']"
1470,"उम्मीद है कि next time, मैं dessert के लिए room बचाऊंगा।",1,['dessert'],['neutral']
1471,"Alain Ducasse सब कुछ के लिए best है, मेरा मतलब है कि सब कुछ excelent था।",0,[],[]
1472,"एक typical pizza joint नहीं, बल्कि low key के लिए nice और night के dinner के लिए fairly सस्ता और अच्छा है।",1,['dinner'],['positive']
1473,Corned beef नाजुक था और मेरे mouth में melt हो जाता था।,1,['Corned beef'],['positive']
1474,GO HERE.,0,[],[]
1475,"मेरे पास best Chicken pad tai, जो मैंने कभी लिया है।",1,['Chicken pad tai'],['positive']
1476,हम कुल मिलाकर an hour से अधिक time तक अपनी table पर नहीं थे।,0,[],[]
1477,$20 में आप sushi में बिना हिचक के कुछ भी खा सकते हैं,1,['sushi'],['neutral']
1478,Since मैंने इसे discover किया है यह हमेशा मेरी first choice रही है।,0,[],[]
1479,"Haru बहुत ताज़ा fish serve करता है, एक उभरता, आधुनिक ambiance, Park Avenue South में मुख्य location और मित्रवत service है।",4,"['fish', 'service', 'ambiance', 'location']","['positive', 'positive', 'positive', 'positive']"
1480,Winter में warm और friendly और गर्मी के months में outdoor seating की सुविधा।,1,['outdoor seating'],['positive']
1481,"हम बिलकुल थोड़ा tipsy से sake हो गए, नहीं तो Saturday nights क्या girlfriends के साथ नहीं होते?",1,['sake'],['neutral']
1482,I loved it and will be back soon.,0,[],[]
1483,"हमेशा से nice crowd, लेकिन कभी loud नहीं",1,['crowd'],['positive']
1484,"मेरे turkey burger को बिल्कुल नहीं पकाया गया था, मेरे friends का salmon पूरी तरह से raw था।",2,"['turkey burger', 'salmon']","['negative', 'negative']"
1485,"Service spotty है, कभी-कभी really friendly और कभी-कभी barely ही।",1,['Service'],['conflict']
1486,Decor minimalist और clean है - distract  करने या commend करने के लिए कुछ भी नहीं।,1,['Decor'],['neutral']
1487,"उसके drinks बहुत inventive, स्वादिष्ट और classy हैं।",1,['drinks'],['positive']
1488,"महान food, महान prices, महान service.",3,"['food', 'prices', 'service']","['positive', 'positive', 'positive']"
1489,यह आपका corner नहीं है Chinese food ले जाइए।,1,['Chinese food'],['neutral']
1490,"हालांकि, यह place Joya और Thai की तुलना में बहुत कम pretension है और Thai food अभी भी above-average है।",2,"['place', 'Thai food']","['positive', 'positive']"
1491,"मेरे पति और मैंने यहाँ review पढ़कर खाया भी और साथ ही साथ hobokeni.com,",0,[],[]
1492,"Regular menu से order के लिए try करें, फिर आपको regret नहीं होगा!",1,['menu'],['positive']
1493,"हमें कहीं भी बैठने के लिए कहा, और जब हम बैठे तो उन्होंने कहा कि table reserved थी।",1,['table'],['negative']
1494,"uni from maine vs california, sea vs freshwater eel) to get a good taste comparison.",1,['eel'],['neutral']
1495,"हमने lox और mussels के साथ शुरुआत की (अब तक का जो हमने best खाया), और dinner में cod और trout खाया था।",5,"['lox', 'mussels', 'cod', 'trout', 'dinner']","['positive', 'positive', 'neutral', 'neutral', 'neutral']"
1496,"Crispy chicken हमारे लिए नहीं था, फिर भी।",1,['Crispy chicken'],['negative']
1497,JUST AWSOME.,0,[],[]
1498,Food is great.,1,['Food'],['positive']
1499,यहाँ उनके लिए बहुत से variety हैं जो मेरी तरह vegetarian खाते हैं।,0,[],[]
1500,यह place incredibly छोटा है।,1,['place'],['negative']
1501,यह तो sure है की हम definetely back जाएँगे।,0,[],[]
1502,"मैंने complaint नहीं किया, मुझे atmosphere बहुत पसंद आया।",1,['atmosphere'],['positive']
1503,यह हमारे all-time favorite में से एक है।,0,[],[]
1504,"लेकिन जब आप बैठे हैं waitresses कमाल हैं, वे menu की सभी चीजों को explain करती हैं, और जो service आपको मिलती है उसके लिए food की price really cheap है।",5,"['waitresses', 'price', 'service', 'menu', 'food']","['positive', 'positive', 'positive', 'neutral', 'neutral']"
1505,यह place amazingly बुरा है।,0,[],[]
1506,मैं Dim Sum के लिए several places पर गया हूं और यह मुझे और WORST मिला है।,1,['Dim Sum'],['negative']
1507,I love this place.,0,[],[]
1508,"सबसे fresh, सबसे अच्छी variety और सबसे fast delivery.",2,"['variety', 'delivery']","['positive', 'positive']"
1509,1st class service और terrific food के लिए Volare जाएं।,2,"['service', 'food']","['positive', 'positive']"
1510,यह super-trendy और उस empty seat को लेने के लिए हमेशा कोई न कोई होता है इसलिए ऐसा लगता है कि customer service के essence को नहीं समझा गया है।,2,"['service', 'seat']","['positive', 'neutral']"
1511,"Sandwiches सूखी, बेस्वाद और overpriced हैं।",1,['Sandwiches'],['negative']
1512,Problem just इतना है कि यह एक type का affair है।,0,[],[]
1513,Price एक Jersey से अधिक नहीं है लेकिन better है।,1,['Price'],['positive']
1514,Fried rice वास्तव में बहुत good है।,1,['Fried rice'],['positive']
1515,मेरे dining experience को uncomfortable बना दिया।,1,['dining experience'],['negative']
1516,It's a steal!,0,[],[]
1517,हम internet पर पहले के comments को देखकर इस restaurant में गए।,0,[],[]
1518,"फिर भी दूर रहें, हमारे बगल की table मेरी table से बाहर निकल गई और एक और जहाँ वे हैं वहाँ रहते हुए भी serves करते हैं ...",1,['serves'],['negative']
1519,मैं 7 की party के साथ था (front doors के बगल में नहीं बल्कि close में) और हम अपने coast में खा रहे थे।,1,['front doors'],['neutral']
1520,Friendly service के आधार पर एक बहुत ही inviting restaurant है।,1,['service'],['positive']
1521,"Back garden sitting area बहुत ही सुहावना है, जहाँ आप उनके personal herb garden को देख सकते हैं।",2,"['Back garden sitting area', 'personal herb garden']","['positive', 'positive']"
1522,दोनों में क्या difference है?,0,[],[]
1523,"जब तक आप Katz' Deli में 4 pound के pastrami sandwiches नहीं खा रहे हैं तब तक आप एक अच्छे French restaurant के शानदार restaurant से वंचित हैं, या Mexican food जो capable restaurants द्वारा supply की जाती है।",2,"['pastrami sandwiches', 'Mexican food']","['neutral', 'neutral']"
1524,मैं इस restaurant से बहुत disappoint था।,0,[],[]
1525,Drinks हमेशा अच्छा बना है और wine selection काफी priced है।,3,"['Drinks', 'wine selection', 'priced']","['positive', 'neutral', 'positive']"
1526,हमने एक house salad भी share किया था जो fresh था।,1,['house salad'],['positive']
1527,Ceiling शानदार है!,1,['Ceiling'],['positive']
1528,मैं और मेरी wife NYC में अपना 30th anniversary मना रहे थे।,0,[],[]
1529,मैं glad हूँ कि मुझे इस place पर introduced किया गया था और जो NY में एक rare gem है।,0,[],[]
1530,और इस culinary nightmare का conclusion check हमारी table पर एक glass of water से knock करके दिया गया।,3,"['check', 'table', 'glass of water']","['neutral', 'neutral', 'neutral']"
1531,Area में अच्छे french food के लिए यह एक small feat नहीं है।,1,['french food'],['positive']
1532,"Live music के लिए space थोड़ा बहुत small है, इसलिए jazz nights पर, यह loud और cramped हो सकता है।",3,"['Live music', 'space', 'jazz nights']","['neutral', 'negative', 'neutral']"
