,sentence,#aspect terms,aspect_terms,at_polarity
2303,एक untrendy rip-off के लिए यहाँ खाइये।,0,[],[]
2304,और कुछ hours बाद तुम hungry थे।,0,[],[]
2305,मैं back जाने के लिए wait नहीं कर सकता।,0,[],[]
2306,मुझे इस place से HATE HATE HATE करता हूँ।,0,[],[]
2307,यहां तक कि हमारी Manager की ओर से visit हुई थी जो यह sure करना चाहते थे कि हम खुद को enjoy कर रहे हैं।,1,['Manager'],['positive']
2308,वहाँ staff बहुत attentive और सरल है।,1,['staff'],['positive']
2309,"आप Mizu excellent service के लिए नहीं जाते हैं, आप food की अधिक मात्रा के लिए जाते हैं, एक amiable atmosphere, और hole-in-the-wall place की feeling के लिए जाते हैं। ",3,"['service', 'food', 'atmosphere']","['negative', 'positive', 'positive']"
2310,"यह service हमेशा के लिए bad है, अपने server से कुछ ज्यादा expect ना कीजिये, और ना मैं यहाँ एक date करने को recommend करूंगा।  ",2,"['service', 'server']","['negative', 'negative']"
2311,Monday nights को prix fix में $28 की bargain है - इसमें three course meal के साथ three glasses of wine हर एक course के साथ paired रहते हैं।,4,"['prix fix', 'three course meal', 'glasses of wine', 'course']","['positive', 'positive', 'positive', 'neutral']"
2312,Wonderful!,0,[],[]
2313,उन्हे हमारे glasses में water डालने के लिए 15 minutes लगे।,1,['water'],['neutral']
2314,Service descent है जबकि यह छोटा सा place packed है।,2,"['Service', 'place']","['positive', 'negative']"
2315,New York city - hands down में यह सबसे अच्छी sushi है।,1,['sushi'],['positive']
2316,Hungry जाओ और enjoy करो।,0,[],[]
2317,मैंने यहाँ बहुत से pizza खाएं हैं।,1,['pizza'],['neutral']
2318,यह place one-hour drive के लायक है।,0,[],[]
2319,Quality ingredients के लिए शानदार value है।,1,['ingredients'],['positive']
2320,"Thali छोटी, thoroughly unremarkable और $14.95 की थी।",1,['Thali'],['negative']
2321,Sushi भी great है!,1,['Sushi'],['positive']
2322,एक delicate butternut squash ravioli in a delicious truffle sauce में एक amazing buttery and tender langostine entree के chef app से और dessert में tender langostine entree जो मुझे fabulous Cakebread Cabernet के पीने की वजह से याद नहीं -- पूरी evening शानदार थी।,5,"['chef app', 'delicate butternut squash ravioli in a delicious truffle sauce', 'buttery and tender langostine entree', 'dessert', 'Cakebread Cabernet']","['positive', 'positive', 'positive', 'neutral', 'positive']"
2323,सच में attentive waiter का एक mark है.,1,['waiter'],['positive']
2324,"यहां का food काफी अच्छा है, लेकिन केवल तभी जब आप इसके लिए wait करना पसंद करते हैं।",1,['food'],['positive']
2325,मुझे एक excellent cheesecake का piece मिला और हमने बहुत से दूसरे nice pastries खाये।,2,"['cheesecake', 'pastries']","['positive', 'positive']"
2326,"Staff बहुत kind और well trained है, वे fast हैं, वे हमेशा bar के पीछे जाने और fix drinks के लिए तैयार हैं, वे menu में सभी items के details जानते हैं और शानदार recommendations देते हैं।",4,"['Staff', 'bar', 'drinks', 'menu']","['positive', 'neutral', 'neutral', 'neutral']"
2327,Makhani OK था --korma नरम था।,2,"['Makhani', 'korma']","['neutral', 'negative']"
2328,यह food inventive है लेकिन फिर भी traditional indian flavoring में दिखता है।,1,['food'],['positive']
2329,सब मिलाकर कह सकता हूँ कि WOW है!,0,[],[]
2330,"हालांकि service better हो सकती है (possibly house में एक से अधिक large group के कारण), यह बहुत cordial और warm है, जैसा कि general clientele.",1,['service'],['conflict']
2331,"इस place का decor बहुत diner-ish है और जिस तरह का place तुम East Village में expect करते हो - romantic नहीं, लेकिन simple, small और sparse है।",2,"['decor', 'place']","['positive', 'positive']"
2332,यह एक cute place है और good हो सकती है लेकिन उन्हें अपने act को एक साथ लाने की need है।,1,['place'],['positive']
2333,Lox भी हमेशा fresh है।,1,['Lox'],['positive']
2334,"काफी sure हूं, बिलकुल 30 minutes के बाद हमें एक call आया और हम promptly बैठे थे।",0,[],[]
2335,Service बहुत friendly था।,1,['Service'],['positive']
2336,तो मैं केवल यह कहने की try कर रहा हूं कि यह restaurant अब तक का best thai food restaurant है जहां मैं कभी गया हूं।,1,['thai food'],['positive']
2337,Food OK था - fish अच्छे से cooked था।,2,"['Food', 'fish']","['neutral', 'positive']"
2338,हम वास्तव में hungry रह गए और कुछ good chinese food के लिए street के पार 15 Mott street पर Wo Hop गए।,1,['chinese food'],['positive']
2339,Duck confit हमेशा शानदार है और foie gras terrine with figs इस world से अलग था।,2,"['foie gras terrine with figs', 'Duck confit']","['positive', 'positive']"
2340,"सारा set up सच में unprofessional है और मैं wish करता हूं कि Cafe Noir को कुछ अच्छे staff मिलेंगे, क्योंकि current वाले के अलावा यह एक great place है।",1,['staff'],['negative']
2341,Service में कभी-कभी focus की कमी होती है और यदि आप hurry में हैं तो यह ideal नहीं है लेकिन मेरे साथ कभी भी rudely treat नहीं किया गया है।,1,['Service'],['conflict']
2342,Staff impeccable service offer करते है।,2,"['Staff', 'service']","['positive', 'positive']"
2343,Catch ऐसा है कि आपसे कुछ भी extra charge लिया गया है जिसे आप अपनी plate में छोड़ देते हैं इसलिए greedy pig मत बनो!,0,[],[]
2344,हमने अपना great experience waiter द्वारा recommended एक Gulab Jamun (dessert) खाकर end किया।,2,"['Gulab Jamun (dessert)', 'waiter']","['positive', 'positive']"
2345,Sure फिर से back नहीं आएंगे।,0,[],[]
2346,मैं अपनी family के साथ एक year पहले utsav गया।,0,[],[]
2347,"इस place की तुलना Mamoun's में price के साथ, freshness, value, और consistent quality के लिए नहीं करता है, लेकिन यह मेरा केवल opinion है।",4,"['price', 'freshness', 'value', 'quality']","['negative', 'negative', 'negative', 'negative']"
2348,"Place sleek, modern और playfull है और मैं बार-बार लौटूंगा। ",1,['Place'],['positive']
2349,"मैंने यह secret last 13 years में जाना है, Emilio (Godfather) ने लगातार food और wine gods के लिए mortal prices पर serve किया है।",3,"['food', 'wine', 'prices']","['positive', 'positive', 'positive']"
2350,Party favors की तरह brioche and lollies सबसे memorable meal के लिए एक cute और sweet touch है।,2,"['brioche and lollies', 'meal']","['positive', 'positive']"
2351,"यह बताने के बाद हम तीनों की party 10 minutes में बैठ जाएगी और दूसरे parties को देखेगी (2 या फिर अधिक) 40 minutes के लिए बैठ गयी, हम तीनों छोटे से 2-person table में बैठाये गए।",1,['2-person table'],['negative']
2352,और bill outragous था।,1,['bill'],['negative']
2353,"Service attentive थी, फिर भी unimposing है, food Midtown के कई notorious restaurants से बहुत ही अच्छा था और wine list extensive और well priced है।",4,"['Service', 'food', 'wine list', 'priced']","['conflict', 'positive', 'positive', 'positive']"
2354,"Kind, attentive wait staff.",1,['wait staff'],['positive']
2355,Bon appettite!!,0,[],[]
2356,Salads शानदार थे।,1,['Salads'],['positive']
2357,Owners और employees friendly हैं और उनका pizza शानदार है।,3,"['Owners', 'employees', 'pizza']","['positive', 'positive', 'positive']"
2358,"La Rosa में चलता है, और मुझे लगता है कि वे इसे best कर रहे हैं।",0,[],[]
2359,"Food yammy है, ज़्यादातर उनके mussels in spicy tomato sauce और उनके shoestring crispy fries में बने cooked-to-perfection हैं।",3,"['Food', 'mussels in spicy tomato sauce', 'fries']","['positive', 'positive', 'positive']"
2360,Food authentic Italian है- स्वादिष्ट है!,1,['Food'],['positive']
2361,"Smith Street में एक great addition: finally, एक ऐसा place, जो pretentious नहीं है और Ugg boots पहनने वाली women से filled है।",0,[],[]
2362,Dessert छोड़ दो।,1,['Dessert'],['negative']
2363,हमने इस place पर $200 spend किए और hungry रह गए और बहुत disappointed हैं।,0,[],[]
2364,यह simply amazing है।,0,[],[]
2365,मैंने total bagel experience को थोड़ा toasted करके पूरा करता हूँ।,1,['bagel'],['positive']
2366,यह कुछ servers के भूलने जैसा था कि वे actually वहाँ work किए और उसके लिए hang out करना और cool रहने लगे।,1,['servers'],['negative']
2367,मुझे यह place first time में पसंद आया लेकिन doubt है कि कभी return हो पाऊँगा।,0,[],[]
2368,Service अच्छी है और ambience date के लिए या group outing के लिए अच्छा है।,2,"['Service', 'ambience']","['positive', 'positive']"
2369,Money कमाने का एक great तरीका है कि Costco से एक case of snapple buy करें और उसके ठीक बाहर केवल $2.50 का sell कर दें।,1,['case of snapple'],['neutral']
2370,यह सब food के बारे में है!!,1,['food'],['positive']
2371,Fast service.,1,['service'],['positive']
2372,"इस restaurant को छोड़ दें, यह एक big disappointment है।",0,[],[]
2373,"Staff excellent है, special है: bar के पीछे वह girl, european chic हैं।",2,"['Staff', 'bar']","['positive', 'neutral']"
2374,"Chicken, beef, और lamb dishes के साथ लगे रहो।",3,"['Chicken', 'beef', 'lamb dishes']","['positive', 'positive', 'positive']"
2375,"Service बुरी थी,  food हमेशा के लिए आता है, हम upper level पर बैठे हैं।",2,"['Service', 'food']","['negative', 'negative']"
2376,"हम एक menu है जो केवल एक या दो specials छोड़कर वाकई बदलते रहते हैं, quality और care जो वे food में डालते हैं evident हैं।  ",4,"['quality', 'care', 'food', 'specials']","['positive', 'positive', 'positive', 'neutral']"
2377,हमेशा tourists से full रहता है (especially क्योंकि इसकी Rockefeller Center से close proximity है)।,0,[],[]
2378,"Decor अच्छा है, लेकिन fine dining की तुलना में ज्यादा causal है।",1,['Decor'],['conflict']
2379,यह restaurant कई times जाने के लिए wonderful place है और यह reasonably priced है।,1,['priced'],['positive']
2380,"Bravo, Blue Hill!",0,[],[]
2381,Bedford ave के right पर होने के कारण भी conveniently located है।,0,[],[]
2382,मेरा friend और मैं village में walk करते समय इस place पर आए।,0,[],[]
2383,"Bottom line: food के लिए B+, service के लिए F।",2,"['food', 'service']","['positive', 'negative']"
2384,"केवल एक चीज जो waiters आपके लिए नहीं करते हैं, वह है जब आप जाते हैं तो अपनी chin wipe कर लें।",1,['waiters'],['positive']
2385,यह place avoide करने के लिए है।,0,[],[]
2386,"Dimsum के साथ, ना कि super overprised noodles है।",2,"['noodles', 'Dimsum']","['neutral', 'positive']"
2387,Service ठीक है और वो आपको view enjoy करने के लिए allow करते हैं।,2,"['Service', 'view']","['positive', 'positive']"
2388,मेरी sister कहती है यह उसे high-school के students द्वारा संचालित एक restaurant की याद दिलाता है जो नहीं जानते कि वे क्या कर रहे हैं।,0,[],[]
2389,"हम, वहाँ four थे, जो noon में आए थे - place empty था - और staff ने ऐसे act किया कि हम उनपर impose कर रहे हैं और वे बहुत rude थे।",1,['staff'],['negative']
2390,"6:30 पर, हम वहाँ पर third party थे।",0,[],[]
2391,एक अच्छे outdoor atmosphere में स्वादिष्ट simple food।,2,"['food', 'atmosphere']","['positive', 'positive']"
2392,मैं भी definetly वापस जाऊंगा।,0,[],[]
2393,"No, really.",0,[],[]
2394,"Food अच्छा है, लेकिन इसकी casualness के लिए बहुत expensive है।",1,['Food'],['conflict']
2395,इस restaurant का fallback केवल इसके prices हैं।,1,['prices'],['negative']
2396,मैं Naples 45 में dinner के लिए twice गया हूँ।,1,['dinner'],['neutral']
2397,Hot और sour soup असहनीय रूप से hot था और केवल pepper का taste था और कुछ नहीं।,2,"['soup', 'pepper']","['negative', 'negative']"
2398,मुझे andy warhol के ये pics पसंद हैं जब वह अक्सर place पर जाता था (उसने window में ballato's sign paint किया था)।,0,[],[]
2399,Try sushimi cucumber roll.,1,['sushimi cucumber roll'],['positive']
2400,मैं अपने next visit के लिए save कर रहा हूँ।,0,[],[]
2401,Food शानदार है।,1,['Food'],['positive']
2402,वहाँ wines by the glass एक great accompaniment है और आप $30 के अंदर wine के साथ एक king की तरह खा सकते हैं।,2,"['wines by the glass', 'wine']","['positive', 'neutral']"
2403,इस place का ambience correct है और उसी time आपको guest की तरह feel कराने के लिए एक friend की तरह staff है।,3,"['place', 'ambience', 'staff']","['positive', 'positive', 'positive']"
2404,Amma कुछ special नहीं हैं।,0,[],[]
2405,"हाँ, Shanghai भी बहुत great है लेकिन उतना good नहीं है - वे उसी amount का salt प्रयोग करते हैं लेकिन sweetness को balance out किए बिना।",1,['salt'],['negative']
2406,"हमारा believe करो, हम 15 years से अधिक से sushi खा रहे हैं।",1,['sushi'],['neutral']
2407,किसी भी time और special occasion के लायक है।,0,[],[]
2408,Atmosphere Sripraphai (ज्यादा modern और sleek) से बहुत अच्छा है।,1,['Atmosphere'],['positive']
2409,मैं उसे recommend करता हूँ जो dress up करना चाहता है और lady को impress करना चाहता है।,0,[],[]
2410,"Food outstanding है और service तेज़ है, friendly और बहुत professional है",2,"['Food', 'service']","['positive', 'positive']"
2411,"Bagels हमेशा warm रहता है, अंदर से soft, बाहर से crispy और size में enormous है। ",1,['Bagels'],['positive']
2412,"मैंने Lucky Stike में late dinner किया, अगर हम एकबार देखें तो एक joint के लिए एक great name है।",1,['dinner'],['neutral']
2413,"वहाँ गया, वो कर दिया, और New York, यह उतनी बड़ी deal नहीं है।",0,[],[]
2414,Definitely एक year में एक बार treat करता हूँ कि मैं holidays के आस-पास देखता हूँ!,0,[],[]
2415,Service तेज़ और friendly है।,1,['Service'],['positive']
2416,एक English speaking staff से।,1,['staff'],['neutral']
2417,"कैसे भी, जब तक हम चाहें बैठ सकते थे और chat कर सकते थे, जो nice था।",0,[],[]
2418,और उनके पास bar में ये homemade potato chips है जो world में सबसे delicious चीज़ है।,2,"['potato chips', 'bar']","['positive', 'neutral']"
2419,A definitely must visit.,0,[],[]
2420,मेरे husband और मैंने सभी 6 taste size portions को enjoy किया और completely full छोड़ दिया।,1,['portions'],['positive']
2421,"मैं यहाँ एक friend के साथ whim पर गया था, हम पहले किसी और place पर गए और एक table नहीं मिला। ",1,['table'],['negative']
2422,हम सभी ने pasta entre'es खाया जो great था।,1,['pasta entre'es'],['positive']
2423,मेरे friends और मैंने Sat को show up किया।,0,[],[]
2424,Steak excellent था और मैंने जो खाया उसमें best था (मैंने शुरुवात में butter को taste किया था लेकिन किसी भी तरह से यह meat के flavor को बढ़ा नहीं पाया था)।,4,"['Steak', 'butter', 'flavor', 'meat']","['positive', 'negative', 'neutral', 'positive']"
2425,कुल मिलाकर great experience।,0,[],[]
2426,DATES के लिए perfect है!,0,[],[]
2427,Food boring और महंगा था।,1,['Food'],['negative']
2428,"Ambience conversation के लिए बहुत pretty और nice है, इसलिए यहाँ एक casual lunch शायद best होगा।",2,"['Ambience', 'lunch']","['positive', 'positive']"
2429,Unique rolls से भरा हुआ शानदार menu है और special dishes हैं।,3,"['menu', 'rolls', 'dishes']","['positive', 'positive', 'positive']"
2430,Service ठीक है लेकिन better हो सकता थी।,1,['Service'],['negative']
2431,"हमें food, drinks और atmosphere पसंद है।",3,"['food', 'drinks', 'atmosphere']","['positive', 'positive', 'positive']"
2432,मैं कुछ weeks पहले यहाँ था और हमने इस restaurant का अब तक का worst customer service experience किया था।,1,['customer service'],['negative']
2433,मैंने 2nd ave से order दिया था।,0,[],[]
2434,"एक good sales call के खिलाफ कुछ भी नहीं है, लेकिन अम्मा पर tactics बहुत obvious है। ",0,[],[]
2435,"3 day oyster binge में Fish अपने साथ पालते हुए गया, और मैं बहुत खुश हूँ कि यही वह place है जहां trip खत्म हुआ था। ",3,"['place', 'oyster', 'Fish']","['positive', 'neutral', 'neutral']"
2436,"Mother's Day पर अपनी mom को ले गया, और maitre d काफी rude था।",1,['maitre d'],['negative']
2437,मेरे husband और मैं वहाँ कई दफा कुछ times के लिए गए और हर time हम sushi bar (chef Yoshi) में बैठे और सभी ala carte का order दिया।,3,"['sushi bar', 'chef', 'ala carte']","['neutral', 'neutral', 'neutral']"
2438,"Vibe बहुत relaxed और cozy है, service शानदार थी और food कमाल का था!",3,"['Vibe', 'service', 'food']","['positive', 'positive', 'positive']"
2439,"अगर weather अच्छा है, तो बाहर की table को रोके रखने का try करें।",1,['table'],['positive']
2440,यदि आप एक good quality के cheap eats को देख रहे हैं - तो यही वह place है।,1,['quality'],['positive']
2441,"जबकि, जो भी overall हम spent करते हैं, बस यह केवल par नहीं होता है।",0,[],[]
2442,Service friendly और atmosphere casual था।,2,"['Service', 'atmosphere']","['positive', 'positive']"
2443,Seattle से एक friend और मैं Thursday night करीब 8:30 बजे गए।,0,[],[]
2444,जब मैं कुछ देर के लिए upstate रहता था तो मैं bagels freeze buy करता था और वे अब भी किसी और से better होंगे।,1,['bagels'],['neutral']
2445,"मैं उनके Pad See Ew, Pork Chops या Tofu plates recommend करता हूँ।",3,"['Pad See Ew', 'Pork Chops', 'Tofu plates']","['positive', 'positive', 'positive']"
2446,मैंने अपने life में कभी नहीं सोचा था कि मैं NYC में $3.00 के लिए taste और quantity दोनों में satisfy हो सकता हूँ।,2,"['taste', 'quantity']","['positive', 'positive']"
2447,"यह midtown में सबसे अच्छा secret place है', मैंने यह bartender से सुना था कि एक brilliant food खाने के बाद (steak with portobello mushrooms try करें) और पिछले Tuesday को bar में drinks था।",5,"['bartender', 'food', 'drinks', 'steak with portobello mushrooms', 'bar']","['neutral', 'positive', 'positive', 'positive', 'neutral']"
2448,Service excellent था - friendly और attentive था।,1,['Service'],['positive']
2449,"Main course एक average portion था, और कुल मिलाकर decent था।",2,"['Main course', 'portion']","['positive', 'neutral']"
2450,हमारे reservation के लिए 20 minutes हैं लेकिन इसने हमें cocktails के लिए कुछ time दिया और हमारे surroundings और आपस में enjoy किया।,3,"['reservation', 'cocktails', 'surroundings']","['negative', 'positive', 'positive']"
2451,"बस याद रखना, जितना late तुम जाओगे, उतना long तुम्हें wait करना पड़ेगा।",0,[],[]
2452,"Waitstaff बहुत शानदार, attentive है।",1,['Waitstaff'],['positive']
2453,मैं neighborhood में रहती हूँ और regular हूँ।,0,[],[]
2454,Dinner menu बहुत diverse और top-notch भी है।,1,['Dinner menu'],['positive']
2455,यह सब MODERN CUISINE के बारे में है।,1,['CUISINE'],['positive']
